row_idx,subject_id,sentence_index,task_name,source_file,target_string,seq_len
3415,ZKW,60,task1-SR,resultsZKW_SR.mat,"Like a documentary version of Fight Club, shorn of social insight, intellectual pretension and cinematic interest.",16
3416,ZKW,61,task1-SR,resultsZKW_SR.mat,"Stephen Rea, Aidan Quinn, and Alan Bates play Desmond's legal eagles, and when joined by Brosnan, the sight of this grandiloquent quartet lolling in pretty Irish settings is a pleasant enough thing, `tis.",33
3417,ZKW,62,task1-SR,resultsZKW_SR.mat,"It's a powerful though flawed movie, guaranteed to put a lump in your throat while reaffirming Washington as possibly the best actor working in movies today.",26
3418,ZKW,63,task1-SR,resultsZKW_SR.mat,An intriguing and entertaining introduction to Johnson.,7
3419,ZKW,64,task1-SR,resultsZKW_SR.mat,Everything was as superficial as the forced New Jersey lowbrow accent Uma had.,13
3420,ZKW,65,task1-SR,resultsZKW_SR.mat,"Despite the holes in the story and the somewhat predictable plot, moments of the movie caused me to jump in my chair...",22
3421,ZKW,66,task1-SR,resultsZKW_SR.mat,`How many more voyages can this limping but dearly-loved franchise survive?',11
3422,ZKW,67,task1-SR,resultsZKW_SR.mat,If only the story about a multi-million dollar con bothered to include the con.,14
3423,ZKW,68,task1-SR,resultsZKW_SR.mat,"It is supremely unfunny and unentertaining to watch middle-age and older men drink to excess, piss on trees, b.s. one another and put on a show in drag.",28
3424,ZKW,69,task1-SR,resultsZKW_SR.mat,"Only a few minutes elapse before the daddy of all slashers arrives, still with the boiler suit and white mask, which look remarkably clean for a guy who has been mass-murdering since 1978 but has never been seen doing laundry.",40
3425,ZKW,70,task1-SR,resultsZKW_SR.mat,"Showtime is one of the hapless victims of the arrogant ``if we put together a wry white man and a chatty black man and give them guns, the movie will be funny'' syndrome.",33
3426,ZKW,71,task1-SR,resultsZKW_SR.mat,"Whatever heartwarming scene the impressively discreet filmmakers may have expected to record with their mini DV, they show a remarkable ability to document both sides of this emotional car-wreck.",29
3427,ZKW,72,task1-SR,resultsZKW_SR.mat,"A zombie movie in every sense of the word -- mindless, lifeless, meandering, loud, painful, obnoxious.",16
3428,ZKW,73,task1-SR,resultsZKW_SR.mat,"It has fun with the quirks of family life, but it also treats the subject with fondness and respect.",19
3429,ZKW,74,task1-SR,resultsZKW_SR.mat,"Novak manages to capture a cruelly hilarious vein of black comedy in the situation with his cast of non-actors and a gritty, no-budget approach.",24
3430,ZKW,75,task1-SR,resultsZKW_SR.mat,"Since Lee is a sentimentalist, the film is more worshipful than your random E!",14
3431,ZKW,76,task1-SR,resultsZKW_SR.mat,"The movie is almost completely lacking in suspense, surprise and consistent emotional conviction.",13
3432,ZKW,77,task1-SR,resultsZKW_SR.mat,"High Crimes knows the mistakes that bad movies make and is determined not to make them, and maybe that is nobility of a sort.",24
3433,ZKW,78,task1-SR,resultsZKW_SR.mat,But it's too long and too convoluted and it ends in a muddle.,13
3434,ZKW,79,task1-SR,resultsZKW_SR.mat,This thing works on no level whatsoever for me.,9
3435,ZKW,80,task1-SR,resultsZKW_SR.mat,... a bland murder-on-campus yawner.,5
3436,ZKW,81,task1-SR,resultsZKW_SR.mat,In comparison to his earlier films it seems a disappointingly thin slice of lower-class London life; despite the title... amounts to surprisingly little.,23
3437,ZKW,82,task1-SR,resultsZKW_SR.mat,"One of the finest, most humane and important Holocaust movies ever made.",12
3438,ZKW,83,task1-SR,resultsZKW_SR.mat,"Suffers from rambling, repetitive dialogue and the visual drabness endemic to digital video.",13
3439,ZKW,84,task1-SR,resultsZKW_SR.mat,"The twist that ends the movie is the one with the most emotional resonance, but twists are getting irritating, and this is the kind of material where the filmmakers should be very careful about raising eyebrows.",36
3440,ZKW,85,task1-SR,resultsZKW_SR.mat,"Angel presents events partly from the perspective of Aurelie and Christelle, and infuses the film with the sensibility of a particularly nightmarish fairytale.",23
3441,ZKW,86,task1-SR,resultsZKW_SR.mat,Features one of the most affecting depictions of a love affair ever committed to film.,15
3442,ZKW,87,task1-SR,resultsZKW_SR.mat,It is intensely personal and yet -- unlike Quills -- deftly shows us the temper of the times.,18
3443,ZKW,88,task1-SR,resultsZKW_SR.mat,"Even as I valiantly struggled to remain interested, or at least conscious, I could feel my eyelids... getting... very... heavy...",20
3444,ZKW,89,task1-SR,resultsZKW_SR.mat,"... a solid, well-formed satire.",5
3445,ZKW,90,task1-SR,resultsZKW_SR.mat,Deserves high marks for political courage but barely gets by on its artistic merits.,14
3446,ZKW,91,task1-SR,resultsZKW_SR.mat,Read My Lips is to be viewed and treasured for its extraordinary intelligence and originality as well as its lyrical variations on the game of love.,26
3447,ZKW,92,task1-SR,resultsZKW_SR.mat,"... creates a visceral sense of its characters' lives and conflicted emotions that carries it far above... what could have been a melodramatic, Lifetime Channel-style anthology.",26
3448,ZKW,93,task1-SR,resultsZKW_SR.mat,Reeks of rot and hack work from start to finish.,10
3449,ZKW,94,task1-SR,resultsZKW_SR.mat,Just how these families interact may surprise you.,8
3450,ZKW,95,task1-SR,resultsZKW_SR.mat,"The Movie is what happens when you blow up small potatoes to 10 times their natural size, and it ain't pretty.",21
3451,ZKW,96,task1-SR,resultsZKW_SR.mat,"Even a hardened voyeur would require the patience of Job to get through this interminable, shapeless documentary about the swinging subculture.",21
3452,ZKW,97,task1-SR,resultsZKW_SR.mat,"Creepy, authentic and dark.",4
3453,ZKW,98,task1-SR,resultsZKW_SR.mat,A lame romantic comedy about an unsympathetic character and someone who would not likely be so stupid as to get involved with her.,23
3454,ZKW,99,task1-SR,resultsZKW_SR.mat,"Rob Schneider's infantile cross-dressing routines fill The Hot Chick, the latest gimmick from this unimaginative comedian.",16
3455,ZKW,100,task1-SR,resultsZKW_SR.mat,"The film is a contrivance, as artificial as the video games Japanese teens play in a nightclub sequence, but it's an enjoyable one.",23
3456,ZKW,101,task1-SR,resultsZKW_SR.mat,"At its worst the screenplay is callow, but at its best it is a young artist's thoughtful consideration of fatherhood.",20
3457,ZKW,102,task1-SR,resultsZKW_SR.mat,At 78 minutes it just zings along with vibrance and warmth.,11
3458,ZKW,103,task1-SR,resultsZKW_SR.mat,"Only an epic documentary could get it all down, and Spike Lee's Jim Brown: All American at long last gives its subject a movie worthy of his talents.",28
3459,ZKW,104,task1-SR,resultsZKW_SR.mat,"As quiet, patient and tenacious as Mr. Lopez himself, who approaches his difficult, endless work with remarkable serenity and discipline.",20
3460,ZKW,105,task1-SR,resultsZKW_SR.mat,"Instead of hiding Pinocchio from critics, Miramax should have hidden it from everyone.",13
3461,ZKW,106,task1-SR,resultsZKW_SR.mat,What a great shame that such a talented director as Chen Kaige has chosen to make his English-language debut with a film so poorly plotted and scripted.,27
3462,ZKW,107,task1-SR,resultsZKW_SR.mat,Jeffs has created a breathtakingly assured and stylish work of spare dialogue and acute expressiveness.,15
3463,ZKW,108,task1-SR,resultsZKW_SR.mat,"Just about the best straight-up, old-school horror film of the last 15 years.",13
3464,ZKW,109,task1-SR,resultsZKW_SR.mat,"Gosling creates a staggeringly compelling character, a young man whose sharp intellect is at the very root of his contradictory, self-hating, self-destructive ways.",23
3465,ZKW,110,task1-SR,resultsZKW_SR.mat,"I thought the relationships were wonderful, the comedy was funny, and the love `real'.",14
3466,ZKW,111,task1-SR,resultsZKW_SR.mat,Better at putting you to sleep than a sound machine.,10
3467,ZKW,112,task1-SR,resultsZKW_SR.mat,Feels less like a cousin to Blade Runner than like a bottom-feeder sequel in the Escape From New York series.,20
3468,ZKW,113,task1-SR,resultsZKW_SR.mat,"Elegantly produced and expressively performed, the six musical numbers crystallize key plot moments into minutely detailed wonders of dreamlike ecstasy.",20
3469,ZKW,114,task1-SR,resultsZKW_SR.mat,"Ultimate X is a ride, basically the kind of greatest-hits reel that might come with a subscription to ESPN the Magazine.",21
3470,ZKW,115,task1-SR,resultsZKW_SR.mat,"Celebrated at Sundance, this slight comedy of manners has winning performances and a glossy, glib charm that's hard to beat.",20
3471,ZKW,116,task1-SR,resultsZKW_SR.mat,"Apparently, romantic comedy with a fresh point of view just doesn't figure in the present Hollywood program.",17
3472,ZKW,117,task1-SR,resultsZKW_SR.mat,That Haynes can both maintain and dismantle the facades that his genre and his character construct is a wonderous accomplishment of veracity and narrative grace.,25
3473,ZKW,118,task1-SR,resultsZKW_SR.mat,"Some elements of it really blow the big one, but other parts are decent.",14
3474,ZKW,119,task1-SR,resultsZKW_SR.mat,"No French people were harmed during the making of this movie, but they were insulted and the audience was put through torture for an hour and a half.",28
3475,ZKW,120,task1-SR,resultsZKW_SR.mat,"I was feeling this movie until it veered off too far into the Exxon zone, and left me behind at the station looking for a return ticket to realism.",29
3476,ZKW,121,task1-SR,resultsZKW_SR.mat,The simplicity of The Way Home has few equals this side of Aesop.,13
3477,ZKW,122,task1-SR,resultsZKW_SR.mat,Exceptionally well acted by Diane Lane and Richard Gere.,9
3478,ZKW,123,task1-SR,resultsZKW_SR.mat,"Dong shows how intolerance has the power to deform families, then tear them apart.",14
3479,ZKW,124,task1-SR,resultsZKW_SR.mat,"A stupid, derivative horror film that substitutes extreme gore for suspense.",11
3480,ZKW,125,task1-SR,resultsZKW_SR.mat,It's a great American adventure and a wonderful film to bring to IMAX.,13
3481,ZKW,126,task1-SR,resultsZKW_SR.mat,It's 51 times better than this.,6
3482,ZKW,127,task1-SR,resultsZKW_SR.mat,"It's like an old Warner Bros. costumer jived with sex -- this could be the movie Errol Flynn always wanted to make, though Bette Davis, cast as Joan, would have killed him.",32
3483,ZKW,128,task1-SR,resultsZKW_SR.mat,"A miraculous movie, I'm Going Home is so slight, yet overflows with wisdom and emotion.",15
3484,ZKW,129,task1-SR,resultsZKW_SR.mat,"A fiercely clever and subtle film, capturing the precarious balance between the extravagant confidence of the exiled aristocracy and the cruel earnestness of the victorious revolutionaries.",26
3485,ZKW,130,task1-SR,resultsZKW_SR.mat,"It's as if you're watching a movie that was made in 1978 but not released then because it was so weak, and it has been unearthed and released now, when it has become even weaker.",35
3486,ZKW,131,task1-SR,resultsZKW_SR.mat,Anemic chronicle of money grubbing New Yorkers and their serial loveless hook ups.,13
3487,ZKW,132,task1-SR,resultsZKW_SR.mat,"Thanks to a small star with big heart, this family film sequel is plenty of fun for all.",18
3488,ZKW,133,task1-SR,resultsZKW_SR.mat,And I've decided to leave a light on every night from now on.,13
3489,ZKW,134,task1-SR,resultsZKW_SR.mat,Festers in just such a dungpile that you'd swear you were watching monkeys flinging their feces at you.,18
3490,ZKW,135,task1-SR,resultsZKW_SR.mat,under-rehearsed and lifeless,3
3491,ZKW,136,task1-SR,resultsZKW_SR.mat,Exactly what you'd expect from a guy named Kaos.,9
3492,ZKW,137,task1-SR,resultsZKW_SR.mat,"If legendary shlockmeister Ed Wood had ever made a movie about a vampire, it probably would look a lot like this alarming production, adapted from Anne Rice's novel The Vampire Chronicles.",31
3493,ZKW,138,task1-SR,resultsZKW_SR.mat,"For those for whom the name Woody Allen was once a guarantee of something fresh, sometimes funny, and usually genuinely worthwhile, Hollywood Ending is a depressing experience.",27
3494,ZKW,139,task1-SR,resultsZKW_SR.mat,Bella is the picture of health with boundless energy until a few days before she dies.,16
3495,ZKW,140,task1-SR,resultsZKW_SR.mat,"The fun of the movie is the chance it affords to watch Jackson, who also served as executive producer, take his smooth, shrewd, powerful act abroad.",26
3496,ZKW,141,task1-SR,resultsZKW_SR.mat,What should have been a cutting Hollywood satire is instead about as fresh as last week's issue of Variety.,19
3497,ZKW,142,task1-SR,resultsZKW_SR.mat,"Cox offers plenty of glimpses at existing photos, but there are no movies of Nijinsky, so instead the director treats us to an aimless hodgepodge.",25
3498,ZKW,143,task1-SR,resultsZKW_SR.mat,Aaliyah rarely dampens her diva persona enough to spark genuine chemistry with Townsend.,13
3499,ZKW,144,task1-SR,resultsZKW_SR.mat,Mr. Soderbergh's direction and visual style struck me as unusually and unimpressively fussy and pretentious.,15
3500,ZKW,145,task1-SR,resultsZKW_SR.mat,Mazel tov to a film about a family's joyous life acting on the Yiddish stage.,15
3501,ZKW,146,task1-SR,resultsZKW_SR.mat,... would be a total loss if not for two supporting performances taking place at the movie's edges.,18
3502,ZKW,147,task1-SR,resultsZKW_SR.mat,An inspiring and heart-affecting film about the desperate attempts of Vietnamese refugees living in U.S. relocation camps to keep their hopes alive in 1975.,24
3503,ZKW,148,task1-SR,resultsZKW_SR.mat,"Loud, chaotic and largely unfunny.",5
3504,ZKW,149,task1-SR,resultsZKW_SR.mat,The immersive powers of the giant screen and its hyper-realistic images are put to perfect use in the breathtakingly beautiful outer-space documentary Space Station 3D.,25
3505,ZKW,150,task1-SR,resultsZKW_SR.mat,It's everything you don't go to the movies for.,9
3506,ZKW,151,task1-SR,resultsZKW_SR.mat,"Harris is supposed to be the star of the story, but comes across as pretty dull and wooden.",18
3507,ZKW,152,task1-SR,resultsZKW_SR.mat,Allen's funniest and most likeable movie in years.,8
3508,ZKW,153,task1-SR,resultsZKW_SR.mat,"For those who pride themselves on sophisticated, discerning taste, this might not seem like the proper cup of tea, however it is almost guaranteed that even the stuffiest cinema goers will laugh their 1*** off for an hour-and-a-half.",38
3509,ZKW,154,task1-SR,resultsZKW_SR.mat,"There is a refreshing absence of cynicism in Stuart Little 2 -- quite a rarity, even in the family film market.",21
3510,ZKW,155,task1-SR,resultsZKW_SR.mat,There are plot holes big enough for Shamu the killer whale to swim through.,14
3511,ZKW,156,task1-SR,resultsZKW_SR.mat,... always remains movingly genuine.,5
3512,ZKW,157,task1-SR,resultsZKW_SR.mat,"Stitch is a bad mannered, ugly and destructive little ****.",10
3513,ZKW,158,task1-SR,resultsZKW_SR.mat,The cast is top-notch and I predict there will be plenty of female audience members drooling over Michael Idemoto as Michael.,21
3514,ZKW,159,task1-SR,resultsZKW_SR.mat,Kirshner and Monroe seem to be in a contest to see who can out-bad-act the other.,16
3515,ZKW,160,task1-SR,resultsZKW_SR.mat,This is one of those war movies that focuses on human interaction rather than battle and action sequences... and it's all the stronger because of it.,26
3516,ZKW,161,task1-SR,resultsZKW_SR.mat,"Like life on the island, the movie grows boring despite the scenery.",12
3517,ZKW,162,task1-SR,resultsZKW_SR.mat,It's anchored by splendid performances from an honored screen veteran and a sparkling newcomer who instantly transform themselves into a believable mother/daughter pair.,23
3518,ZKW,163,task1-SR,resultsZKW_SR.mat,An atonal estrogen opera that demonizes feminism while gifting the most sympathetic male of the piece with a nice vomit bath at his wedding.,24
3519,ZKW,164,task1-SR,resultsZKW_SR.mat,"Even by the intentionally low standards of frat-boy humor, Sorority Boys is a bowser.",14
3520,ZKW,165,task1-SR,resultsZKW_SR.mat,"Director of photography Benoit Delhomme shot the movie in delicious colors, and the costumes and sets are grand.",18
3521,ZKW,166,task1-SR,resultsZKW_SR.mat,The only entertainment you'll derive from this choppy and sloppy affair will be from unintentional giggles -- several of them.,20
3522,ZKW,167,task1-SR,resultsZKW_SR.mat,The film serves as a valuable time capsule to remind us of the devastating horror suffered by an entire people.,20
3523,ZKW,168,task1-SR,resultsZKW_SR.mat,"A bittersweet contemporary comedy about benevolent deception, which, while it may not rival the filmmaker's period pieces, is still very much worth seeing.",23
3524,ZKW,169,task1-SR,resultsZKW_SR.mat,Attal pushes too hard to make this a comedy or serious drama.,12
3525,ZKW,170,task1-SR,resultsZKW_SR.mat,Isabelle Huppert excels as the enigmatic Mika and Anna Mouglalis is a stunning new young talent in one of Chabrol's most intense psychological mysteries.,24
3526,ZKW,171,task1-SR,resultsZKW_SR.mat,A small movie with a big impact.,7
3527,ZKW,172,task1-SR,resultsZKW_SR.mat,This bold and lyrical first feature from Raja Amari expands the pat notion that middle-aged women just wanna have fun into a rousing treatise of sensual empowerment.,27
3528,ZKW,173,task1-SR,resultsZKW_SR.mat,Photographed with melancholy richness and eloquently performed yet also decidedly uncinematic.,11
3529,ZKW,174,task1-SR,resultsZKW_SR.mat,"Hey Arnold! is now stretched to barely feature length, with a little more attention paid to the animation.",18
3530,ZKW,175,task1-SR,resultsZKW_SR.mat,"After that, it just gets stupid and maudlin.",8
3531,ZKW,176,task1-SR,resultsZKW_SR.mat,"The stunning, dreamlike visuals will impress even those viewers who have little patience for Euro-film pretension.",16
3532,ZKW,177,task1-SR,resultsZKW_SR.mat,"Plods along, minus the twisted humor and eye-popping visuals that have made Miike... a cult hero.",16
3533,ZKW,178,task1-SR,resultsZKW_SR.mat,"Impresses as a skillfully assembled, highly polished and professional adaptation... just about as chilling and unsettling as `Manhunter' was.",19
3534,ZKW,179,task1-SR,resultsZKW_SR.mat,"For the most part, it's a work of incendiary genius, steering clear of knee-jerk reactions and quick solutions.",18
3535,ZKW,180,task1-SR,resultsZKW_SR.mat,"It's badly acted, blandly directed, and could have been scripted by someone who just graduated from elementary school.",18
3536,ZKW,181,task1-SR,resultsZKW_SR.mat,"The sort of picture in which, whenever one of the characters has some serious soul searching to do, they go to a picture-perfect beach during sunset.",26
3537,ZKW,182,task1-SR,resultsZKW_SR.mat,"Despite its raucous intent, XXX is as conventional as a Nike ad and as rebellious as spring break.",18
3538,ZKW,183,task1-SR,resultsZKW_SR.mat,... a roller-coaster ride of a movie,7
3539,ZKW,184,task1-SR,resultsZKW_SR.mat,"A colorful, vibrant introduction to a universal human impulse, lushly photographed and beautifully recorded.",14
3540,ZKW,185,task1-SR,resultsZKW_SR.mat,Audiard successfully maintains suspense on different levels throughout a film that is both gripping and compelling.,16
3541,ZKW,186,task1-SR,resultsZKW_SR.mat,Even horror fans will most likely not find what they're seeking with Trouble Every Day; the movie lacks both thrills and humor.,22
3542,ZKW,187,task1-SR,resultsZKW_SR.mat,After that it becomes long and tedious like a classroom play in a college history course.,16
3543,ZKW,188,task1-SR,resultsZKW_SR.mat,"This is cool, slick stuff, ready to quench the thirst of an audience that misses the summer blockbusters.",18
3544,ZKW,189,task1-SR,resultsZKW_SR.mat,"Blade II has a brilliant director and charismatic star, but it suffers from rampant vampire devaluation.",16
3545,ZKW,190,task1-SR,resultsZKW_SR.mat,"A loud, ugly, irritating movie without any of its satirical salvos hitting a discernible target.",15
3546,ZKW,191,task1-SR,resultsZKW_SR.mat,"For VeggieTales fans, this is more appetizing than a side dish of asparagus.",13
3547,ZKW,192,task1-SR,resultsZKW_SR.mat,"While it regards 1967 as the key turning point of the 20th century, and returns again and again to images of dissidents in the streets, it's alarmingly current.",28
3548,ZKW,193,task1-SR,resultsZKW_SR.mat,A truly wonderful tale combined with stunning animation.,8
3549,ZKW,194,task1-SR,resultsZKW_SR.mat,"Nothing sticks, really, except a lingering creepiness one feels from being dragged through a sad, sordid universe of guns, drugs, avarice and damaged dreams.",24
3550,ZKW,195,task1-SR,resultsZKW_SR.mat,``Simone'' is a fun and funky look into an artificial creation in a world that thrives on artificiality.,18
3551,ZKW,196,task1-SR,resultsZKW_SR.mat,"It's a hoot watching The Rock chomp on jumbo ants, pull an arrow out of his back, and leap unscathed through raging fire!",23
3552,ZKW,197,task1-SR,resultsZKW_SR.mat,"While Tattoo borrows heavily from both Seven and The Silence of the Lambs, it manages to maintain both a level of sophisticated intrigue and human-scale characters that suck the audience in.",31
3553,ZKW,198,task1-SR,resultsZKW_SR.mat,A portrait of an artist.,5
3554,ZKW,199,task1-SR,resultsZKW_SR.mat,"As written by Michael Berg and Michael J. Wilson from a story by Wilson, this relentless, all-wise-guys-all-the-time approach tries way too hard and gets tiring in no time at all.",30
3555,ZKW,200,task1-SR,resultsZKW_SR.mat,"It's the best film of the year so far, the benchmark against which all other Best Picture contenders should be measured.",21
3556,ZKW,201,task1-SR,resultsZKW_SR.mat,This is one of the biggest disappointments of the year.,10
3557,ZKW,202,task1-SR,resultsZKW_SR.mat,It never fails to engage us.,6
3558,ZKW,203,task1-SR,resultsZKW_SR.mat,"Denis forges out of the theories of class - based rage and sisterly obsession a razor-sided tuning fork that rings with cultural, sexual and social discord.",26
3559,ZKW,204,task1-SR,resultsZKW_SR.mat,The movie slides downhill as soon as macho action conventions assert themselves.,12
3560,ZKW,205,task1-SR,resultsZKW_SR.mat,"More romantic, more emotional and ultimately more satisfying than the teary-eyed original.",12
3561,ZKW,206,task1-SR,resultsZKW_SR.mat,"Like the best of Godard's movies... it is visually ravishing, penetrating, impenetrable.",12
3562,ZKW,207,task1-SR,resultsZKW_SR.mat,The cumulative effect of the movie is repulsive and depressing.,10
3563,ZKW,208,task1-SR,resultsZKW_SR.mat,"Feels like nothing quite so much as a middle-aged moviemaker's attempt to surround himself with beautiful, half-naked women.",18
3564,ZKW,209,task1-SR,resultsZKW_SR.mat,"A very long movie, dull in stretches, with entirely too much focus on meal preparation and igloo construction.",18
3565,ZKW,210,task1-SR,resultsZKW_SR.mat,"In XXX, Diesel is that rare creature -- an action hero with table manners, and one who proves that elegance is more than tattoo deep.",25
3566,ZKW,211,task1-SR,resultsZKW_SR.mat,I'm not sure which will take longer to heal: the welt on Johnny Knoxville's stomach from a riot-control projectile or my own tortured psyche.,24
3567,ZKW,212,task1-SR,resultsZKW_SR.mat,"While Serving Sara does have a long way to go before it reaches the level of crudity in the latest Austin Powers extravaganza, there's nothing here to match that movie's intermittent moments of inspiration.",34
3568,ZKW,213,task1-SR,resultsZKW_SR.mat,"It's difficult to conceive of anyone who has reached puberty actually finding the characters in Slackers or their antics amusing, let alone funny.",23
3569,ZKW,214,task1-SR,resultsZKW_SR.mat,"It never is, not fully.",5
3570,ZKW,215,task1-SR,resultsZKW_SR.mat,"Not only is Undercover Brother as funny, if not more so, than both Austin Powers films, but it's also one of the smarter, savvier spoofs to come along in some time.",31
3571,ZKW,216,task1-SR,resultsZKW_SR.mat,It should be mentioned that the set design and interiors of the haunted vessel are more than effectively creepy and moodily lit.,22
3572,ZKW,217,task1-SR,resultsZKW_SR.mat,"With the exception of some fleetingly amusing improvisations by Cedric the Entertainer as Perry's boss, there isn't a redeeming moment here.",21
3573,ZKW,218,task1-SR,resultsZKW_SR.mat,It's a funny little movie with clever dialogue and likeable characters.,11
3574,ZKW,219,task1-SR,resultsZKW_SR.mat,"``13 Conversations'' holds its goodwill close, but is relatively slow to come to the point.",15
3575,ZKW,220,task1-SR,resultsZKW_SR.mat,"Not the kind of film that will appeal to a mainstream American audience, but there is a certain charm about the film that makes it a suitable entry into the fest circuit.",32
3576,ZKW,221,task1-SR,resultsZKW_SR.mat,"You come away wishing, though, that the movie spent a lot less time trying to make a credible case for reports from the afterlife and a lot more time on the romantic urgency that's at the center of the story.",40
3577,ZKW,222,task1-SR,resultsZKW_SR.mat,The movie is virtually without context -- journalistic or historical.,10
3578,ZKW,223,task1-SR,resultsZKW_SR.mat,"After sitting through this sloppy, made-for-movie comedy special, it makes me wonder if Lawrence hates criticism so much that he refuses to evaluate his own work.",26
3579,ZKW,224,task1-SR,resultsZKW_SR.mat,Genuinely touching because it's realistic about all kinds of love.,10
3580,ZKW,225,task1-SR,resultsZKW_SR.mat,"For all the complications, it's all surprisingly predictable.",8
