row_idx,subject_id,sentence_index,task_name,source_file,target_string,seq_len
2217,ZJN,381,task1-SR,resultsZJN_SR.mat,"The art direction is often exquisite, and the anthropomorphic animal characters are beautifully realized through clever makeup design, leaving one to hope that the eventual DVD release will offer subtitles and the original Italian-language soundtrack.",35
2218,ZJN,382,task1-SR,resultsZJN_SR.mat,"... Jones, despite a definitely distinctive screen presence, just isn't able to muster for a movie that, its title notwithstanding, should have been a lot nastier if it wanted to fully capitalize on its lead's specific gifts.",37
2219,ZJN,383,task1-SR,resultsZJN_SR.mat,But what's nice is that there's a casual intelligence that permeates the script.,13
2220,ZJN,387,task1-SR,resultsZJN_SR.mat,"Every individual will see the movie through the prism of his or her own beliefs and prejudices, but the one thing most will take away is the sense that peace is possible.",32
2221,ZJN,388,task1-SR,resultsZJN_SR.mat,"Feels slight, as if it were an extended short, albeit one made by the smartest kids in class.",18
2222,ZJN,389,task1-SR,resultsZJN_SR.mat,The picture doesn't know it's a comedy.,7
2223,ZJN,391,task1-SR,resultsZJN_SR.mat,"Starts out mediocre, spirals downward, and thuds to the bottom of the pool with an utterly incompetent conclusion.",18
2224,ZJN,392,task1-SR,resultsZJN_SR.mat,The sort of movie that gives tastelessness a bad rap.,10
2225,ZJN,393,task1-SR,resultsZJN_SR.mat,Its engaging simplicity is driven by appealing leads.,8
2226,ZJS,1,task1-SR,resultsZJS_SR.mat,"Beautifully crafted, engaging filmmaking that should attract upscale audiences hungry for quality and a nostalgic, twisty yarn that will keep them guessing.",22
2227,ZJS,2,task1-SR,resultsZJS_SR.mat,"Bread, My Sweet has so many flaws it would be easy for critics to shred it.",16
2228,ZJS,3,task1-SR,resultsZJS_SR.mat,"Slow, silly and unintentionally hilarious.",5
2229,ZJS,4,task1-SR,resultsZJS_SR.mat,"Ultimately feels empty and unsatisfying, like swallowing a Communion wafer without the wine.",13
2230,ZJS,6,task1-SR,resultsZJS_SR.mat,The film rehashes several old themes and is capped with pointless extremes -- it's insanely violent and very graphic.,19
2231,ZJS,7,task1-SR,resultsZJS_SR.mat,"Ryan Gosling is, in a word, brilliant as the conflicted Daniel.",11
2232,ZJS,8,task1-SR,resultsZJS_SR.mat,"If Deuces Wild had been tweaked up a notch it would have become a camp adventure, one of those movies that's so bad it starts to become good.",28
2233,ZJS,9,task1-SR,resultsZJS_SR.mat,The film's stagecrafts are intimate and therefore bolder than the otherwise calculated artifice that defines and overwhelms the film's production design.,21
2234,ZJS,10,task1-SR,resultsZJS_SR.mat,"Frida is certainly no disaster, but neither is it the Kahlo movie Frida fans have been looking for.",18
2235,ZJS,11,task1-SR,resultsZJS_SR.mat,The film often achieves a mesmerizing poetry.,7
2236,ZJS,12,task1-SR,resultsZJS_SR.mat,A work of astonishing delicacy and force.,7
2237,ZJS,14,task1-SR,resultsZJS_SR.mat,"For the most part, the ingredients are there.",8
2238,ZJS,15,task1-SR,resultsZJS_SR.mat,"But if you've paid a matinee price and bought a big tub of popcorn, there's guilty fun to be had here.",21
2239,ZJS,16,task1-SR,resultsZJS_SR.mat,"There's not much to Fatale, outside of its stylish surprises... but that's OK.",13
2240,ZJS,18,task1-SR,resultsZJS_SR.mat,"This version moves beyond the original's nostalgia for the communal film experiences of yesteryear to a deeper realization of cinema's inability to stand in for true, lived experience.",28
2241,ZJS,19,task1-SR,resultsZJS_SR.mat,"There's no palpable chemistry between Lopez and male lead Ralph Fiennes, plus the script by Working Girl scribe Kevin Wade is workmanlike in the extreme.",25
2242,ZJS,20,task1-SR,resultsZJS_SR.mat,"A first-class, thoroughly involving B movie that effectively combines two surefire, beloved genres -- the prison flick and the fight film.",21
2243,ZJS,21,task1-SR,resultsZJS_SR.mat,The film is so bad it doesn't improve upon the experience of staring at a blank screen.,17
2244,ZJS,23,task1-SR,resultsZJS_SR.mat,Another Best of the Year selection.,6
2245,ZJS,24,task1-SR,resultsZJS_SR.mat,It's all a rather shapeless good time...,7
2246,ZJS,26,task1-SR,resultsZJS_SR.mat,I love the robust middle of this picture.,8
2247,ZJS,27,task1-SR,resultsZJS_SR.mat,"That's not vintage Spielberg and that, finally, is minimally satisfying.",10
2248,ZJS,28,task1-SR,resultsZJS_SR.mat,The soundtrack alone is worth the price of admission.,9
2249,ZJS,31,task1-SR,resultsZJS_SR.mat,"Featuring a dangerously seductive performance from the great Daniel Auteuil, ``Sade'' covers the same period as Kaufmann's ``Quills'' with more unsettlingly realistic results.",23
2250,ZJS,32,task1-SR,resultsZJS_SR.mat,"The movie is for fans who can't stop loving anime, and the fanatical excess built into it.",17
2251,ZJS,33,task1-SR,resultsZJS_SR.mat,"The Ring is worth a look, if you don't demand much more than a few cheap thrills from your Halloween entertainment.",21
2252,ZJS,35,task1-SR,resultsZJS_SR.mat,"What makes How I Killed My Father compelling, besides its terrific performances, is Fontaine's willingness to wander into the dark areas of parent-child relationships without flinching.",26
2253,ZJS,36,task1-SR,resultsZJS_SR.mat,"This hastily mounted production exists only to capitalize on Hopkins' inclination to play Hannibal Lecter again, even though Harris has no immediate inclination to provide a fourth book.",28
2254,ZJS,40,task1-SR,resultsZJS_SR.mat,"Reassuring, retro uplifter.",3
2255,ZJS,41,task1-SR,resultsZJS_SR.mat,Flaccid drama and exasperatingly slow journey.,6
2256,ZJS,42,task1-SR,resultsZJS_SR.mat,The Movie will reach far beyond its core demographic.,9
2257,ZJS,43,task1-SR,resultsZJS_SR.mat,How did it ever get made?,6
2258,ZJS,44,task1-SR,resultsZJS_SR.mat,I like the new footage and still love the old stuff.,11
2259,ZJS,46,task1-SR,resultsZJS_SR.mat,Could The Country Bears really be as bad as its trailers?,11
2260,ZJS,47,task1-SR,resultsZJS_SR.mat,"At times, the movie looks genuinely pretty.",7
2261,ZJS,48,task1-SR,resultsZJS_SR.mat,It depends on how well flatulence gags fit into your holiday concept.,12
2262,ZJS,50,task1-SR,resultsZJS_SR.mat,The film seems a dead weight.,6
2263,ZJS,51,task1-SR,resultsZJS_SR.mat,"Sparkling, often hilarious romantic jealousy comedy... Attal looks so much like a young Robert DeNiro that it seems the film should instead be called `My Husband Is Travis Bickle'.",29
2264,ZJS,53,task1-SR,resultsZJS_SR.mat,"A lousy movie that's not merely unwatchable, but also unlistenable.",10
2265,ZJS,55,task1-SR,resultsZJS_SR.mat,"A strong script, powerful direction and splendid production design allows us to be transported into the life of Wladyslaw Szpilman, who is not only a pianist, but a good human being.",31
2266,ZJS,56,task1-SR,resultsZJS_SR.mat,"But here's the real damn: It isn't funny, either.",9
2267,ZJS,57,task1-SR,resultsZJS_SR.mat,"Qutting may be a flawed film, but it is nothing if not sincere.",13
2268,ZJS,58,task1-SR,resultsZJS_SR.mat,It's a fanboy `what if?',5
2269,ZJS,59,task1-SR,resultsZJS_SR.mat,... something appears to have been lost in the translation this time.,12
2270,ZJS,62,task1-SR,resultsZJS_SR.mat,"It's a powerful though flawed movie, guaranteed to put a lump in your throat while reaffirming Washington as possibly the best actor working in movies today.",26
2271,ZJS,63,task1-SR,resultsZJS_SR.mat,An intriguing and entertaining introduction to Johnson.,7
2272,ZJS,64,task1-SR,resultsZJS_SR.mat,Everything was as superficial as the forced New Jersey lowbrow accent Uma had.,13
2273,ZJS,65,task1-SR,resultsZJS_SR.mat,"Despite the holes in the story and the somewhat predictable plot, moments of the movie caused me to jump in my chair...",22
2274,ZJS,66,task1-SR,resultsZJS_SR.mat,`How many more voyages can this limping but dearly-loved franchise survive?',11
2275,ZJS,67,task1-SR,resultsZJS_SR.mat,If only the story about a multi-million dollar con bothered to include the con.,14
2276,ZJS,68,task1-SR,resultsZJS_SR.mat,"It is supremely unfunny and unentertaining to watch middle-age and older men drink to excess, piss on trees, b.s. one another and put on a show in drag.",28
2277,ZJS,69,task1-SR,resultsZJS_SR.mat,"Only a few minutes elapse before the daddy of all slashers arrives, still with the boiler suit and white mask, which look remarkably clean for a guy who has been mass-murdering since 1978 but has never been seen doing laundry.",40
2278,ZJS,71,task1-SR,resultsZJS_SR.mat,"Whatever heartwarming scene the impressively discreet filmmakers may have expected to record with their mini DV, they show a remarkable ability to document both sides of this emotional car-wreck.",29
2279,ZJS,72,task1-SR,resultsZJS_SR.mat,"A zombie movie in every sense of the word -- mindless, lifeless, meandering, loud, painful, obnoxious.",16
2280,ZJS,73,task1-SR,resultsZJS_SR.mat,"It has fun with the quirks of family life, but it also treats the subject with fondness and respect.",19
2281,ZJS,74,task1-SR,resultsZJS_SR.mat,"Novak manages to capture a cruelly hilarious vein of black comedy in the situation with his cast of non-actors and a gritty, no-budget approach.",24
2282,ZJS,75,task1-SR,resultsZJS_SR.mat,"Since Lee is a sentimentalist, the film is more worshipful than your random E!",14
2283,ZJS,76,task1-SR,resultsZJS_SR.mat,"The movie is almost completely lacking in suspense, surprise and consistent emotional conviction.",13
2284,ZJS,78,task1-SR,resultsZJS_SR.mat,But it's too long and too convoluted and it ends in a muddle.,13
2285,ZJS,80,task1-SR,resultsZJS_SR.mat,... a bland murder-on-campus yawner.,5
2286,ZJS,81,task1-SR,resultsZJS_SR.mat,In comparison to his earlier films it seems a disappointingly thin slice of lower-class London life; despite the title... amounts to surprisingly little.,23
2287,ZJS,82,task1-SR,resultsZJS_SR.mat,"One of the finest, most humane and important Holocaust movies ever made.",12
2288,ZJS,83,task1-SR,resultsZJS_SR.mat,"Suffers from rambling, repetitive dialogue and the visual drabness endemic to digital video.",13
2289,ZJS,84,task1-SR,resultsZJS_SR.mat,"The twist that ends the movie is the one with the most emotional resonance, but twists are getting irritating, and this is the kind of material where the filmmakers should be very careful about raising eyebrows.",36
2290,ZJS,85,task1-SR,resultsZJS_SR.mat,"Angel presents events partly from the perspective of Aurelie and Christelle, and infuses the film with the sensibility of a particularly nightmarish fairytale.",23
2291,ZJS,86,task1-SR,resultsZJS_SR.mat,Features one of the most affecting depictions of a love affair ever committed to film.,15
2292,ZJS,87,task1-SR,resultsZJS_SR.mat,It is intensely personal and yet -- unlike Quills -- deftly shows us the temper of the times.,18
2293,ZJS,88,task1-SR,resultsZJS_SR.mat,"Even as I valiantly struggled to remain interested, or at least conscious, I could feel my eyelids... getting... very... heavy...",20
2294,ZJS,89,task1-SR,resultsZJS_SR.mat,"... a solid, well-formed satire.",5
2295,ZJS,90,task1-SR,resultsZJS_SR.mat,Deserves high marks for political courage but barely gets by on its artistic merits.,14
2296,ZJS,91,task1-SR,resultsZJS_SR.mat,Read My Lips is to be viewed and treasured for its extraordinary intelligence and originality as well as its lyrical variations on the game of love.,26
2297,ZJS,92,task1-SR,resultsZJS_SR.mat,"... creates a visceral sense of its characters' lives and conflicted emotions that carries it far above... what could have been a melodramatic, Lifetime Channel-style anthology.",26
2298,ZJS,93,task1-SR,resultsZJS_SR.mat,Reeks of rot and hack work from start to finish.,10
2299,ZJS,94,task1-SR,resultsZJS_SR.mat,Just how these families interact may surprise you.,8
2300,ZJS,95,task1-SR,resultsZJS_SR.mat,"The Movie is what happens when you blow up small potatoes to 10 times their natural size, and it ain't pretty.",21
2301,ZJS,100,task1-SR,resultsZJS_SR.mat,"The film is a contrivance, as artificial as the video games Japanese teens play in a nightclub sequence, but it's an enjoyable one.",23
2302,ZJS,101,task1-SR,resultsZJS_SR.mat,"At its worst the screenplay is callow, but at its best it is a young artist's thoughtful consideration of fatherhood.",20
2303,ZJS,102,task1-SR,resultsZJS_SR.mat,At 78 minutes it just zings along with vibrance and warmth.,11
2304,ZJS,105,task1-SR,resultsZJS_SR.mat,"Instead of hiding Pinocchio from critics, Miramax should have hidden it from everyone.",13
2305,ZJS,106,task1-SR,resultsZJS_SR.mat,What a great shame that such a talented director as Chen Kaige has chosen to make his English-language debut with a film so poorly plotted and scripted.,27
2306,ZJS,107,task1-SR,resultsZJS_SR.mat,Jeffs has created a breathtakingly assured and stylish work of spare dialogue and acute expressiveness.,15
2307,ZJS,108,task1-SR,resultsZJS_SR.mat,"Just about the best straight-up, old-school horror film of the last 15 years.",13
2308,ZJS,111,task1-SR,resultsZJS_SR.mat,Better at putting you to sleep than a sound machine.,10
2309,ZJS,112,task1-SR,resultsZJS_SR.mat,Feels less like a cousin to Blade Runner than like a bottom-feeder sequel in the Escape From New York series.,20
2310,ZJS,113,task1-SR,resultsZJS_SR.mat,"Elegantly produced and expressively performed, the six musical numbers crystallize key plot moments into minutely detailed wonders of dreamlike ecstasy.",20
2311,ZJS,114,task1-SR,resultsZJS_SR.mat,"Ultimate X is a ride, basically the kind of greatest-hits reel that might come with a subscription to ESPN the Magazine.",21
2312,ZJS,115,task1-SR,resultsZJS_SR.mat,"Celebrated at Sundance, this slight comedy of manners has winning performances and a glossy, glib charm that's hard to beat.",20
2313,ZJS,117,task1-SR,resultsZJS_SR.mat,That Haynes can both maintain and dismantle the facades that his genre and his character construct is a wonderous accomplishment of veracity and narrative grace.,25
2314,ZJS,118,task1-SR,resultsZJS_SR.mat,"Some elements of it really blow the big one, but other parts are decent.",14
2315,ZJS,119,task1-SR,resultsZJS_SR.mat,"No French people were harmed during the making of this movie, but they were insulted and the audience was put through torture for an hour and a half.",28
2316,ZJS,120,task1-SR,resultsZJS_SR.mat,"I was feeling this movie until it veered off too far into the Exxon zone, and left me behind at the station looking for a return ticket to realism.",29
2317,ZJS,121,task1-SR,resultsZJS_SR.mat,The simplicity of The Way Home has few equals this side of Aesop.,13
2318,ZJS,122,task1-SR,resultsZJS_SR.mat,Exceptionally well acted by Diane Lane and Richard Gere.,9
2319,ZJS,124,task1-SR,resultsZJS_SR.mat,"A stupid, derivative horror film that substitutes extreme gore for suspense.",11
2320,ZJS,125,task1-SR,resultsZJS_SR.mat,It's a great American adventure and a wonderful film to bring to IMAX.,13
2321,ZJS,126,task1-SR,resultsZJS_SR.mat,It's 51 times better than this.,6
2322,ZJS,127,task1-SR,resultsZJS_SR.mat,"It's like an old Warner Bros. costumer jived with sex -- this could be the movie Errol Flynn always wanted to make, though Bette Davis, cast as Joan, would have killed him.",32
2323,ZJS,128,task1-SR,resultsZJS_SR.mat,"A miraculous movie, I'm Going Home is so slight, yet overflows with wisdom and emotion.",15
2324,ZJS,129,task1-SR,resultsZJS_SR.mat,"A fiercely clever and subtle film, capturing the precarious balance between the extravagant confidence of the exiled aristocracy and the cruel earnestness of the victorious revolutionaries.",26
2325,ZJS,130,task1-SR,resultsZJS_SR.mat,"It's as if you're watching a movie that was made in 1978 but not released then because it was so weak, and it has been unearthed and released now, when it has become even weaker.",35
2326,ZJS,131,task1-SR,resultsZJS_SR.mat,Anemic chronicle of money grubbing New Yorkers and their serial loveless hook ups.,13
2327,ZJS,132,task1-SR,resultsZJS_SR.mat,"Thanks to a small star with big heart, this family film sequel is plenty of fun for all.",18
2328,ZJS,133,task1-SR,resultsZJS_SR.mat,And I've decided to leave a light on every night from now on.,13
2329,ZJS,134,task1-SR,resultsZJS_SR.mat,Festers in just such a dungpile that you'd swear you were watching monkeys flinging their feces at you.,18
2330,ZJS,135,task1-SR,resultsZJS_SR.mat,under-rehearsed and lifeless,3
2331,ZJS,136,task1-SR,resultsZJS_SR.mat,Exactly what you'd expect from a guy named Kaos.,9
2332,ZJS,137,task1-SR,resultsZJS_SR.mat,"If legendary shlockmeister Ed Wood had ever made a movie about a vampire, it probably would look a lot like this alarming production, adapted from Anne Rice's novel The Vampire Chronicles.",31
2333,ZJS,139,task1-SR,resultsZJS_SR.mat,Bella is the picture of health with boundless energy until a few days before she dies.,16
2334,ZJS,140,task1-SR,resultsZJS_SR.mat,"The fun of the movie is the chance it affords to watch Jackson, who also served as executive producer, take his smooth, shrewd, powerful act abroad.",26
2335,ZJS,141,task1-SR,resultsZJS_SR.mat,What should have been a cutting Hollywood satire is instead about as fresh as last week's issue of Variety.,19
2336,ZJS,142,task1-SR,resultsZJS_SR.mat,"Cox offers plenty of glimpses at existing photos, but there are no movies of Nijinsky, so instead the director treats us to an aimless hodgepodge.",25
2337,ZJS,143,task1-SR,resultsZJS_SR.mat,Aaliyah rarely dampens her diva persona enough to spark genuine chemistry with Townsend.,13
2338,ZJS,145,task1-SR,resultsZJS_SR.mat,Mazel tov to a film about a family's joyous life acting on the Yiddish stage.,15
2339,ZJS,146,task1-SR,resultsZJS_SR.mat,... would be a total loss if not for two supporting performances taking place at the movie's edges.,18
2340,ZJS,147,task1-SR,resultsZJS_SR.mat,An inspiring and heart-affecting film about the desperate attempts of Vietnamese refugees living in U.S. relocation camps to keep their hopes alive in 1975.,24
2341,ZJS,148,task1-SR,resultsZJS_SR.mat,"Loud, chaotic and largely unfunny.",5
2342,ZJS,149,task1-SR,resultsZJS_SR.mat,The immersive powers of the giant screen and its hyper-realistic images are put to perfect use in the breathtakingly beautiful outer-space documentary Space Station 3D.,25
2343,ZJS,150,task1-SR,resultsZJS_SR.mat,It's everything you don't go to the movies for.,9
2344,ZJS,151,task1-SR,resultsZJS_SR.mat,"Harris is supposed to be the star of the story, but comes across as pretty dull and wooden.",18
2345,ZJS,152,task1-SR,resultsZJS_SR.mat,Allen's funniest and most likeable movie in years.,8
2346,ZJS,153,task1-SR,resultsZJS_SR.mat,"For those who pride themselves on sophisticated, discerning taste, this might not seem like the proper cup of tea, however it is almost guaranteed that even the stuffiest cinema goers will laugh their 1*** off for an hour-and-a-half.",38
2347,ZJS,154,task1-SR,resultsZJS_SR.mat,"There is a refreshing absence of cynicism in Stuart Little 2 -- quite a rarity, even in the family film market.",21
2348,ZJS,155,task1-SR,resultsZJS_SR.mat,There are plot holes big enough for Shamu the killer whale to swim through.,14
2349,ZJS,156,task1-SR,resultsZJS_SR.mat,... always remains movingly genuine.,5
2350,ZJS,159,task1-SR,resultsZJS_SR.mat,Kirshner and Monroe seem to be in a contest to see who can out-bad-act the other.,16
2351,ZJS,161,task1-SR,resultsZJS_SR.mat,"Like life on the island, the movie grows boring despite the scenery.",12
2352,ZJS,164,task1-SR,resultsZJS_SR.mat,"Even by the intentionally low standards of frat-boy humor, Sorority Boys is a bowser.",14
2353,ZJS,165,task1-SR,resultsZJS_SR.mat,"Director of photography Benoit Delhomme shot the movie in delicious colors, and the costumes and sets are grand.",18
2354,ZJS,166,task1-SR,resultsZJS_SR.mat,The only entertainment you'll derive from this choppy and sloppy affair will be from unintentional giggles -- several of them.,20
2355,ZJS,167,task1-SR,resultsZJS_SR.mat,The film serves as a valuable time capsule to remind us of the devastating horror suffered by an entire people.,20
2356,ZJS,169,task1-SR,resultsZJS_SR.mat,Attal pushes too hard to make this a comedy or serious drama.,12
2357,ZJS,170,task1-SR,resultsZJS_SR.mat,Isabelle Huppert excels as the enigmatic Mika and Anna Mouglalis is a stunning new young talent in one of Chabrol's most intense psychological mysteries.,24
2358,ZJS,171,task1-SR,resultsZJS_SR.mat,A small movie with a big impact.,7
2359,ZJS,173,task1-SR,resultsZJS_SR.mat,Photographed with melancholy richness and eloquently performed yet also decidedly uncinematic.,11
2360,ZJS,174,task1-SR,resultsZJS_SR.mat,"Hey Arnold! is now stretched to barely feature length, with a little more attention paid to the animation.",18
2361,ZJS,175,task1-SR,resultsZJS_SR.mat,"After that, it just gets stupid and maudlin.",8
2362,ZJS,176,task1-SR,resultsZJS_SR.mat,"The stunning, dreamlike visuals will impress even those viewers who have little patience for Euro-film pretension.",16
2363,ZJS,177,task1-SR,resultsZJS_SR.mat,"Plods along, minus the twisted humor and eye-popping visuals that have made Miike... a cult hero.",16
2364,ZJS,178,task1-SR,resultsZJS_SR.mat,"Impresses as a skillfully assembled, highly polished and professional adaptation... just about as chilling and unsettling as `Manhunter' was.",19
2365,ZJS,179,task1-SR,resultsZJS_SR.mat,"For the most part, it's a work of incendiary genius, steering clear of knee-jerk reactions and quick solutions.",18
2366,ZJS,180,task1-SR,resultsZJS_SR.mat,"It's badly acted, blandly directed, and could have been scripted by someone who just graduated from elementary school.",18
2367,ZJS,181,task1-SR,resultsZJS_SR.mat,"The sort of picture in which, whenever one of the characters has some serious soul searching to do, they go to a picture-perfect beach during sunset.",26
2368,ZJS,183,task1-SR,resultsZJS_SR.mat,... a roller-coaster ride of a movie,7
2369,ZJS,184,task1-SR,resultsZJS_SR.mat,"A colorful, vibrant introduction to a universal human impulse, lushly photographed and beautifully recorded.",14
2370,ZJS,185,task1-SR,resultsZJS_SR.mat,Audiard successfully maintains suspense on different levels throughout a film that is both gripping and compelling.,16
2371,ZJS,186,task1-SR,resultsZJS_SR.mat,Even horror fans will most likely not find what they're seeking with Trouble Every Day; the movie lacks both thrills and humor.,22
2372,ZJS,187,task1-SR,resultsZJS_SR.mat,After that it becomes long and tedious like a classroom play in a college history course.,16
2373,ZJS,188,task1-SR,resultsZJS_SR.mat,"This is cool, slick stuff, ready to quench the thirst of an audience that misses the summer blockbusters.",18
2374,ZJS,189,task1-SR,resultsZJS_SR.mat,"Blade II has a brilliant director and charismatic star, but it suffers from rampant vampire devaluation.",16
2375,ZJS,190,task1-SR,resultsZJS_SR.mat,"A loud, ugly, irritating movie without any of its satirical salvos hitting a discernible target.",15
2376,ZJS,191,task1-SR,resultsZJS_SR.mat,"For VeggieTales fans, this is more appetizing than a side dish of asparagus.",13
2377,ZJS,192,task1-SR,resultsZJS_SR.mat,"While it regards 1967 as the key turning point of the 20th century, and returns again and again to images of dissidents in the streets, it's alarmingly current.",28
2378,ZJS,193,task1-SR,resultsZJS_SR.mat,A truly wonderful tale combined with stunning animation.,8
2379,ZJS,194,task1-SR,resultsZJS_SR.mat,"Nothing sticks, really, except a lingering creepiness one feels from being dragged through a sad, sordid universe of guns, drugs, avarice and damaged dreams.",24
2380,ZJS,195,task1-SR,resultsZJS_SR.mat,``Simone'' is a fun and funky look into an artificial creation in a world that thrives on artificiality.,18
2381,ZJS,196,task1-SR,resultsZJS_SR.mat,"It's a hoot watching The Rock chomp on jumbo ants, pull an arrow out of his back, and leap unscathed through raging fire!",23
2382,ZJS,197,task1-SR,resultsZJS_SR.mat,"While Tattoo borrows heavily from both Seven and The Silence of the Lambs, it manages to maintain both a level of sophisticated intrigue and human-scale characters that suck the audience in.",31
2383,ZJS,198,task1-SR,resultsZJS_SR.mat,A portrait of an artist.,5
2384,ZJS,200,task1-SR,resultsZJS_SR.mat,"It's the best film of the year so far, the benchmark against which all other Best Picture contenders should be measured.",21
2385,ZJS,201,task1-SR,resultsZJS_SR.mat,This is one of the biggest disappointments of the year.,10
2386,ZJS,202,task1-SR,resultsZJS_SR.mat,It never fails to engage us.,6
2387,ZJS,203,task1-SR,resultsZJS_SR.mat,"Denis forges out of the theories of class - based rage and sisterly obsession a razor-sided tuning fork that rings with cultural, sexual and social discord.",26
2388,ZJS,204,task1-SR,resultsZJS_SR.mat,The movie slides downhill as soon as macho action conventions assert themselves.,12
2389,ZJS,205,task1-SR,resultsZJS_SR.mat,"More romantic, more emotional and ultimately more satisfying than the teary-eyed original.",12
2390,ZJS,206,task1-SR,resultsZJS_SR.mat,"Like the best of Godard's movies... it is visually ravishing, penetrating, impenetrable.",12
2391,ZJS,207,task1-SR,resultsZJS_SR.mat,The cumulative effect of the movie is repulsive and depressing.,10
2392,ZJS,208,task1-SR,resultsZJS_SR.mat,"Feels like nothing quite so much as a middle-aged moviemaker's attempt to surround himself with beautiful, half-naked women.",18
2393,ZJS,209,task1-SR,resultsZJS_SR.mat,"A very long movie, dull in stretches, with entirely too much focus on meal preparation and igloo construction.",18
