row_idx,subject_id,sentence_index,task_name,source_file,target_string,seq_len
0,ZAB,0,task1-SR,resultsZAB_SR.mat,Presents a good case while failing to provide a reason for us to care beyond the very basic dictums of human decency.,22
1,ZAB,1,task1-SR,resultsZAB_SR.mat,"Beautifully crafted, engaging filmmaking that should attract upscale audiences hungry for quality and a nostalgic, twisty yarn that will keep them guessing.",22
2,ZAB,2,task1-SR,resultsZAB_SR.mat,"Bread, My Sweet has so many flaws it would be easy for critics to shred it.",16
3,ZAB,3,task1-SR,resultsZAB_SR.mat,"Slow, silly and unintentionally hilarious.",5
4,ZAB,4,task1-SR,resultsZAB_SR.mat,"Ultimately feels empty and unsatisfying, like swallowing a Communion wafer without the wine.",13
5,ZAB,5,task1-SR,resultsZAB_SR.mat,Exudes the fizz of a Busby Berkeley musical and the visceral excitement of a sports extravaganza.,16
6,ZAB,6,task1-SR,resultsZAB_SR.mat,The film rehashes several old themes and is capped with pointless extremes -- it's insanely violent and very graphic.,19
7,ZAB,7,task1-SR,resultsZAB_SR.mat,"Ryan Gosling is, in a word, brilliant as the conflicted Daniel.",11
8,ZAB,8,task1-SR,resultsZAB_SR.mat,"If Deuces Wild had been tweaked up a notch it would have become a camp adventure, one of those movies that's so bad it starts to become good.",28
9,ZAB,9,task1-SR,resultsZAB_SR.mat,The film's stagecrafts are intimate and therefore bolder than the otherwise calculated artifice that defines and overwhelms the film's production design.,21
10,ZAB,10,task1-SR,resultsZAB_SR.mat,"Frida is certainly no disaster, but neither is it the Kahlo movie Frida fans have been looking for.",18
11,ZAB,11,task1-SR,resultsZAB_SR.mat,The film often achieves a mesmerizing poetry.,7
12,ZAB,12,task1-SR,resultsZAB_SR.mat,A work of astonishing delicacy and force.,7
13,ZAB,13,task1-SR,resultsZAB_SR.mat,"The movie's plot is almost entirely witless and inane, carrying every gag two or three times beyond its limit to sustain a laugh.",23
14,ZAB,14,task1-SR,resultsZAB_SR.mat,"For the most part, the ingredients are there.",8
15,ZAB,15,task1-SR,resultsZAB_SR.mat,"But if you've paid a matinee price and bought a big tub of popcorn, there's guilty fun to be had here.",21
16,ZAB,16,task1-SR,resultsZAB_SR.mat,"There's not much to Fatale, outside of its stylish surprises... but that's OK.",13
17,ZAB,17,task1-SR,resultsZAB_SR.mat,"The acting is stiff, the story lacks all trace of wit, the sets look like they were borrowed from Gilligan's Island -- and the CGI Scooby might well be the worst special-effects creation of the year.",36
18,ZAB,18,task1-SR,resultsZAB_SR.mat,"This version moves beyond the original's nostalgia for the communal film experiences of yesteryear to a deeper realization of cinema's inability to stand in for true, lived experience.",28
19,ZAB,19,task1-SR,resultsZAB_SR.mat,"There's no palpable chemistry between Lopez and male lead Ralph Fiennes, plus the script by Working Girl scribe Kevin Wade is workmanlike in the extreme.",25
20,ZAB,20,task1-SR,resultsZAB_SR.mat,"A first-class, thoroughly involving B movie that effectively combines two surefire, beloved genres -- the prison flick and the fight film.",21
21,ZAB,21,task1-SR,resultsZAB_SR.mat,The film is so bad it doesn't improve upon the experience of staring at a blank screen.,17
22,ZAB,22,task1-SR,resultsZAB_SR.mat,Weiss and Speck never make a convincing case for the relevance of these two 20th-century footnotes.,16
23,ZAB,23,task1-SR,resultsZAB_SR.mat,Another Best of the Year selection.,6
24,ZAB,24,task1-SR,resultsZAB_SR.mat,It's all a rather shapeless good time...,7
25,ZAB,25,task1-SR,resultsZAB_SR.mat,"Same song, second verse, coulda been better, but it coulda been worse.",12
26,ZAB,26,task1-SR,resultsZAB_SR.mat,I love the robust middle of this picture.,8
27,ZAB,28,task1-SR,resultsZAB_SR.mat,The soundtrack alone is worth the price of admission.,9
28,ZAB,29,task1-SR,resultsZAB_SR.mat,Mostly Martha could have used a little trimming -- 10 or 15 minutes could be cut and no one would notice -- but it's a pleasurable trifle.,27
29,ZAB,30,task1-SR,resultsZAB_SR.mat,"For the rest of us, sitting through Dahmer's two hours amounts to little more than punishment.",16
30,ZAB,31,task1-SR,resultsZAB_SR.mat,"Featuring a dangerously seductive performance from the great Daniel Auteuil, ``Sade'' covers the same period as Kaufmann's ``Quills'' with more unsettlingly realistic results.",23
31,ZAB,32,task1-SR,resultsZAB_SR.mat,"The movie is for fans who can't stop loving anime, and the fanatical excess built into it.",17
32,ZAB,33,task1-SR,resultsZAB_SR.mat,"The Ring is worth a look, if you don't demand much more than a few cheap thrills from your Halloween entertainment.",21
33,ZAB,34,task1-SR,resultsZAB_SR.mat,"Beautifully observed, miraculously unsentimental comedy-drama.",5
34,ZAB,35,task1-SR,resultsZAB_SR.mat,"What makes How I Killed My Father compelling, besides its terrific performances, is Fontaine's willingness to wander into the dark areas of parent-child relationships without flinching.",26
35,ZAB,36,task1-SR,resultsZAB_SR.mat,"This hastily mounted production exists only to capitalize on Hopkins' inclination to play Hannibal Lecter again, even though Harris has no immediate inclination to provide a fourth book.",28
36,ZAB,37,task1-SR,resultsZAB_SR.mat,Bullock's complete lack of focus and ability quickly derails the film.,11
37,ZAB,38,task1-SR,resultsZAB_SR.mat,"... a plotline that's as lumpy as two-day old porridge... the filmmakers' paws, sad to say, were all over this ``un-bear-able'' project!",22
38,ZAB,39,task1-SR,resultsZAB_SR.mat,Crush could be the worst film a man has made about women since Valley of the Dolls.,17
39,ZAB,40,task1-SR,resultsZAB_SR.mat,"Reassuring, retro uplifter.",3
40,ZAB,41,task1-SR,resultsZAB_SR.mat,Flaccid drama and exasperatingly slow journey.,6
41,ZAB,42,task1-SR,resultsZAB_SR.mat,The Movie will reach far beyond its core demographic.,9
42,ZAB,43,task1-SR,resultsZAB_SR.mat,How did it ever get made?,6
43,ZAB,44,task1-SR,resultsZAB_SR.mat,I like the new footage and still love the old stuff.,11
44,ZAB,45,task1-SR,resultsZAB_SR.mat,"It briefly flirts with player masochism, but the point of real interest -- audience sadism -- is evaded completely.",19
45,ZAB,46,task1-SR,resultsZAB_SR.mat,Could The Country Bears really be as bad as its trailers?,11
46,ZAB,47,task1-SR,resultsZAB_SR.mat,"At times, the movie looks genuinely pretty.",7
47,ZAB,48,task1-SR,resultsZAB_SR.mat,It depends on how well flatulence gags fit into your holiday concept.,12
48,ZAB,49,task1-SR,resultsZAB_SR.mat,"The stupidest, most insulting movie of 2002's first quarter.",9
49,ZAB,50,task1-SR,resultsZAB_SR.mat,The film seems a dead weight.,6
50,ZAB,51,task1-SR,resultsZAB_SR.mat,"Sparkling, often hilarious romantic jealousy comedy... Attal looks so much like a young Robert DeNiro that it seems the film should instead be called `My Husband Is Travis Bickle'.",29
51,ZAB,52,task1-SR,resultsZAB_SR.mat,"I did go back and check out the last 10 minutes, but these were more repulsive than the first 30 or 40 minutes.",23
52,ZAB,53,task1-SR,resultsZAB_SR.mat,"A lousy movie that's not merely unwatchable, but also unlistenable.",10
53,ZAB,54,task1-SR,resultsZAB_SR.mat,One of the best films of the year with its exploration of the obstacles to happiness faced by five contemporary individuals... a psychological masterpiece.,24
54,ZAB,55,task1-SR,resultsZAB_SR.mat,"A strong script, powerful direction and splendid production design allows us to be transported into the life of Wladyslaw Szpilman, who is not only a pianist, but a good human being.",31
55,ZAB,56,task1-SR,resultsZAB_SR.mat,"But here's the real damn: It isn't funny, either.",9
56,ZAB,57,task1-SR,resultsZAB_SR.mat,"Qutting may be a flawed film, but it is nothing if not sincere.",13
57,ZAB,58,task1-SR,resultsZAB_SR.mat,It's a fanboy `what if?',5
58,ZAB,59,task1-SR,resultsZAB_SR.mat,... something appears to have been lost in the translation this time.,12
59,ZAB,60,task1-SR,resultsZAB_SR.mat,"Like a documentary version of Fight Club, shorn of social insight, intellectual pretension and cinematic interest.",16
60,ZAB,61,task1-SR,resultsZAB_SR.mat,"Stephen Rea, Aidan Quinn, and Alan Bates play Desmond's legal eagles, and when joined by Brosnan, the sight of this grandiloquent quartet lolling in pretty Irish settings is a pleasant enough thing, `tis.",33
61,ZAB,62,task1-SR,resultsZAB_SR.mat,"It's a powerful though flawed movie, guaranteed to put a lump in your throat while reaffirming Washington as possibly the best actor working in movies today.",26
62,ZAB,63,task1-SR,resultsZAB_SR.mat,An intriguing and entertaining introduction to Johnson.,7
63,ZAB,64,task1-SR,resultsZAB_SR.mat,Everything was as superficial as the forced New Jersey lowbrow accent Uma had.,13
64,ZAB,65,task1-SR,resultsZAB_SR.mat,"Despite the holes in the story and the somewhat predictable plot, moments of the movie caused me to jump in my chair...",22
65,ZAB,66,task1-SR,resultsZAB_SR.mat,`How many more voyages can this limping but dearly-loved franchise survive?',11
66,ZAB,67,task1-SR,resultsZAB_SR.mat,If only the story about a multi-million dollar con bothered to include the con.,14
67,ZAB,68,task1-SR,resultsZAB_SR.mat,"It is supremely unfunny and unentertaining to watch middle-age and older men drink to excess, piss on trees, b.s. one another and put on a show in drag.",28
68,ZAB,70,task1-SR,resultsZAB_SR.mat,"Showtime is one of the hapless victims of the arrogant ``if we put together a wry white man and a chatty black man and give them guns, the movie will be funny'' syndrome.",33
69,ZAB,71,task1-SR,resultsZAB_SR.mat,"Whatever heartwarming scene the impressively discreet filmmakers may have expected to record with their mini DV, they show a remarkable ability to document both sides of this emotional car-wreck.",29
70,ZAB,72,task1-SR,resultsZAB_SR.mat,"A zombie movie in every sense of the word -- mindless, lifeless, meandering, loud, painful, obnoxious.",16
71,ZAB,73,task1-SR,resultsZAB_SR.mat,"It has fun with the quirks of family life, but it also treats the subject with fondness and respect.",19
72,ZAB,74,task1-SR,resultsZAB_SR.mat,"Novak manages to capture a cruelly hilarious vein of black comedy in the situation with his cast of non-actors and a gritty, no-budget approach.",24
73,ZAB,75,task1-SR,resultsZAB_SR.mat,"Since Lee is a sentimentalist, the film is more worshipful than your random E!",14
74,ZAB,76,task1-SR,resultsZAB_SR.mat,"The movie is almost completely lacking in suspense, surprise and consistent emotional conviction.",13
75,ZAB,77,task1-SR,resultsZAB_SR.mat,"High Crimes knows the mistakes that bad movies make and is determined not to make them, and maybe that is nobility of a sort.",24
76,ZAB,78,task1-SR,resultsZAB_SR.mat,But it's too long and too convoluted and it ends in a muddle.,13
77,ZAB,79,task1-SR,resultsZAB_SR.mat,This thing works on no level whatsoever for me.,9
78,ZAB,80,task1-SR,resultsZAB_SR.mat,... a bland murder-on-campus yawner.,5
79,ZAB,81,task1-SR,resultsZAB_SR.mat,In comparison to his earlier films it seems a disappointingly thin slice of lower-class London life; despite the title... amounts to surprisingly little.,23
80,ZAB,82,task1-SR,resultsZAB_SR.mat,"One of the finest, most humane and important Holocaust movies ever made.",12
81,ZAB,83,task1-SR,resultsZAB_SR.mat,"Suffers from rambling, repetitive dialogue and the visual drabness endemic to digital video.",13
82,ZAB,84,task1-SR,resultsZAB_SR.mat,"The twist that ends the movie is the one with the most emotional resonance, but twists are getting irritating, and this is the kind of material where the filmmakers should be very careful about raising eyebrows.",36
83,ZAB,85,task1-SR,resultsZAB_SR.mat,"Angel presents events partly from the perspective of Aurelie and Christelle, and infuses the film with the sensibility of a particularly nightmarish fairytale.",23
84,ZAB,86,task1-SR,resultsZAB_SR.mat,Features one of the most affecting depictions of a love affair ever committed to film.,15
85,ZAB,87,task1-SR,resultsZAB_SR.mat,It is intensely personal and yet -- unlike Quills -- deftly shows us the temper of the times.,18
86,ZAB,88,task1-SR,resultsZAB_SR.mat,"Even as I valiantly struggled to remain interested, or at least conscious, I could feel my eyelids... getting... very... heavy...",20
87,ZAB,89,task1-SR,resultsZAB_SR.mat,"... a solid, well-formed satire.",5
88,ZAB,90,task1-SR,resultsZAB_SR.mat,Deserves high marks for political courage but barely gets by on its artistic merits.,14
89,ZAB,91,task1-SR,resultsZAB_SR.mat,Read My Lips is to be viewed and treasured for its extraordinary intelligence and originality as well as its lyrical variations on the game of love.,26
90,ZAB,92,task1-SR,resultsZAB_SR.mat,"... creates a visceral sense of its characters' lives and conflicted emotions that carries it far above... what could have been a melodramatic, Lifetime Channel-style anthology.",26
91,ZAB,93,task1-SR,resultsZAB_SR.mat,Reeks of rot and hack work from start to finish.,10
92,ZAB,94,task1-SR,resultsZAB_SR.mat,Just how these families interact may surprise you.,8
93,ZAB,95,task1-SR,resultsZAB_SR.mat,"The Movie is what happens when you blow up small potatoes to 10 times their natural size, and it ain't pretty.",21
94,ZAB,96,task1-SR,resultsZAB_SR.mat,"Even a hardened voyeur would require the patience of Job to get through this interminable, shapeless documentary about the swinging subculture.",21
95,ZAB,97,task1-SR,resultsZAB_SR.mat,"Creepy, authentic and dark.",4
96,ZAB,98,task1-SR,resultsZAB_SR.mat,A lame romantic comedy about an unsympathetic character and someone who would not likely be so stupid as to get involved with her.,23
97,ZAB,99,task1-SR,resultsZAB_SR.mat,"Rob Schneider's infantile cross-dressing routines fill The Hot Chick, the latest gimmick from this unimaginative comedian.",16
98,ZAB,100,task1-SR,resultsZAB_SR.mat,"The film is a contrivance, as artificial as the video games Japanese teens play in a nightclub sequence, but it's an enjoyable one.",23
99,ZAB,101,task1-SR,resultsZAB_SR.mat,"At its worst the screenplay is callow, but at its best it is a young artist's thoughtful consideration of fatherhood.",20
100,ZAB,102,task1-SR,resultsZAB_SR.mat,At 78 minutes it just zings along with vibrance and warmth.,11
101,ZAB,103,task1-SR,resultsZAB_SR.mat,"Only an epic documentary could get it all down, and Spike Lee's Jim Brown: All American at long last gives its subject a movie worthy of his talents.",28
102,ZAB,104,task1-SR,resultsZAB_SR.mat,"As quiet, patient and tenacious as Mr. Lopez himself, who approaches his difficult, endless work with remarkable serenity and discipline.",20
103,ZAB,105,task1-SR,resultsZAB_SR.mat,"Instead of hiding Pinocchio from critics, Miramax should have hidden it from everyone.",13
104,ZAB,106,task1-SR,resultsZAB_SR.mat,What a great shame that such a talented director as Chen Kaige has chosen to make his English-language debut with a film so poorly plotted and scripted.,27
105,ZAB,107,task1-SR,resultsZAB_SR.mat,Jeffs has created a breathtakingly assured and stylish work of spare dialogue and acute expressiveness.,15
106,ZAB,108,task1-SR,resultsZAB_SR.mat,"Just about the best straight-up, old-school horror film of the last 15 years.",13
107,ZAB,109,task1-SR,resultsZAB_SR.mat,"Gosling creates a staggeringly compelling character, a young man whose sharp intellect is at the very root of his contradictory, self-hating, self-destructive ways.",23
108,ZAB,110,task1-SR,resultsZAB_SR.mat,"I thought the relationships were wonderful, the comedy was funny, and the love `real'.",14
109,ZAB,111,task1-SR,resultsZAB_SR.mat,Better at putting you to sleep than a sound machine.,10
110,ZAB,112,task1-SR,resultsZAB_SR.mat,Feels less like a cousin to Blade Runner than like a bottom-feeder sequel in the Escape From New York series.,20
111,ZAB,113,task1-SR,resultsZAB_SR.mat,"Elegantly produced and expressively performed, the six musical numbers crystallize key plot moments into minutely detailed wonders of dreamlike ecstasy.",20
112,ZAB,114,task1-SR,resultsZAB_SR.mat,"Ultimate X is a ride, basically the kind of greatest-hits reel that might come with a subscription to ESPN the Magazine.",21
113,ZAB,115,task1-SR,resultsZAB_SR.mat,"Celebrated at Sundance, this slight comedy of manners has winning performances and a glossy, glib charm that's hard to beat.",20
114,ZAB,116,task1-SR,resultsZAB_SR.mat,"Apparently, romantic comedy with a fresh point of view just doesn't figure in the present Hollywood program.",17
115,ZAB,117,task1-SR,resultsZAB_SR.mat,That Haynes can both maintain and dismantle the facades that his genre and his character construct is a wonderous accomplishment of veracity and narrative grace.,25
116,ZAB,118,task1-SR,resultsZAB_SR.mat,"Some elements of it really blow the big one, but other parts are decent.",14
117,ZAB,119,task1-SR,resultsZAB_SR.mat,"No French people were harmed during the making of this movie, but they were insulted and the audience was put through torture for an hour and a half.",28
118,ZAB,120,task1-SR,resultsZAB_SR.mat,"I was feeling this movie until it veered off too far into the Exxon zone, and left me behind at the station looking for a return ticket to realism.",29
119,ZAB,121,task1-SR,resultsZAB_SR.mat,The simplicity of The Way Home has few equals this side of Aesop.,13
120,ZAB,122,task1-SR,resultsZAB_SR.mat,Exceptionally well acted by Diane Lane and Richard Gere.,9
121,ZAB,123,task1-SR,resultsZAB_SR.mat,"Dong shows how intolerance has the power to deform families, then tear them apart.",14
122,ZAB,124,task1-SR,resultsZAB_SR.mat,"A stupid, derivative horror film that substitutes extreme gore for suspense.",11
123,ZAB,125,task1-SR,resultsZAB_SR.mat,It's a great American adventure and a wonderful film to bring to IMAX.,13
124,ZAB,126,task1-SR,resultsZAB_SR.mat,It's 51 times better than this.,6
125,ZAB,127,task1-SR,resultsZAB_SR.mat,"It's like an old Warner Bros. costumer jived with sex -- this could be the movie Errol Flynn always wanted to make, though Bette Davis, cast as Joan, would have killed him.",32
126,ZAB,128,task1-SR,resultsZAB_SR.mat,"A miraculous movie, I'm Going Home is so slight, yet overflows with wisdom and emotion.",15
127,ZAB,129,task1-SR,resultsZAB_SR.mat,"A fiercely clever and subtle film, capturing the precarious balance between the extravagant confidence of the exiled aristocracy and the cruel earnestness of the victorious revolutionaries.",26
128,ZAB,130,task1-SR,resultsZAB_SR.mat,"It's as if you're watching a movie that was made in 1978 but not released then because it was so weak, and it has been unearthed and released now, when it has become even weaker.",35
129,ZAB,131,task1-SR,resultsZAB_SR.mat,Anemic chronicle of money grubbing New Yorkers and their serial loveless hook ups.,13
130,ZAB,132,task1-SR,resultsZAB_SR.mat,"Thanks to a small star with big heart, this family film sequel is plenty of fun for all.",18
131,ZAB,133,task1-SR,resultsZAB_SR.mat,And I've decided to leave a light on every night from now on.,13
132,ZAB,134,task1-SR,resultsZAB_SR.mat,Festers in just such a dungpile that you'd swear you were watching monkeys flinging their feces at you.,18
133,ZAB,135,task1-SR,resultsZAB_SR.mat,under-rehearsed and lifeless,3
134,ZAB,136,task1-SR,resultsZAB_SR.mat,Exactly what you'd expect from a guy named Kaos.,9
135,ZAB,137,task1-SR,resultsZAB_SR.mat,"If legendary shlockmeister Ed Wood had ever made a movie about a vampire, it probably would look a lot like this alarming production, adapted from Anne Rice's novel The Vampire Chronicles.",31
136,ZAB,138,task1-SR,resultsZAB_SR.mat,"For those for whom the name Woody Allen was once a guarantee of something fresh, sometimes funny, and usually genuinely worthwhile, Hollywood Ending is a depressing experience.",27
137,ZAB,139,task1-SR,resultsZAB_SR.mat,Bella is the picture of health with boundless energy until a few days before she dies.,16
138,ZAB,140,task1-SR,resultsZAB_SR.mat,"The fun of the movie is the chance it affords to watch Jackson, who also served as executive producer, take his smooth, shrewd, powerful act abroad.",26
139,ZAB,141,task1-SR,resultsZAB_SR.mat,What should have been a cutting Hollywood satire is instead about as fresh as last week's issue of Variety.,19
140,ZAB,142,task1-SR,resultsZAB_SR.mat,"Cox offers plenty of glimpses at existing photos, but there are no movies of Nijinsky, so instead the director treats us to an aimless hodgepodge.",25
141,ZAB,143,task1-SR,resultsZAB_SR.mat,Aaliyah rarely dampens her diva persona enough to spark genuine chemistry with Townsend.,13
142,ZAB,144,task1-SR,resultsZAB_SR.mat,Mr. Soderbergh's direction and visual style struck me as unusually and unimpressively fussy and pretentious.,15
143,ZAB,145,task1-SR,resultsZAB_SR.mat,Mazel tov to a film about a family's joyous life acting on the Yiddish stage.,15
144,ZAB,146,task1-SR,resultsZAB_SR.mat,... would be a total loss if not for two supporting performances taking place at the movie's edges.,18
145,ZAB,147,task1-SR,resultsZAB_SR.mat,An inspiring and heart-affecting film about the desperate attempts of Vietnamese refugees living in U.S. relocation camps to keep their hopes alive in 1975.,24
146,ZAB,148,task1-SR,resultsZAB_SR.mat,"Loud, chaotic and largely unfunny.",5
147,ZAB,149,task1-SR,resultsZAB_SR.mat,The immersive powers of the giant screen and its hyper-realistic images are put to perfect use in the breathtakingly beautiful outer-space documentary Space Station 3D.,25
148,ZAB,150,task1-SR,resultsZAB_SR.mat,It's everything you don't go to the movies for.,9
149,ZAB,151,task1-SR,resultsZAB_SR.mat,"Harris is supposed to be the star of the story, but comes across as pretty dull and wooden.",18
150,ZAB,152,task1-SR,resultsZAB_SR.mat,Allen's funniest and most likeable movie in years.,8
151,ZAB,153,task1-SR,resultsZAB_SR.mat,"For those who pride themselves on sophisticated, discerning taste, this might not seem like the proper cup of tea, however it is almost guaranteed that even the stuffiest cinema goers will laugh their 1*** off for an hour-and-a-half.",38
152,ZAB,154,task1-SR,resultsZAB_SR.mat,"There is a refreshing absence of cynicism in Stuart Little 2 -- quite a rarity, even in the family film market.",21
153,ZAB,155,task1-SR,resultsZAB_SR.mat,There are plot holes big enough for Shamu the killer whale to swim through.,14
154,ZAB,156,task1-SR,resultsZAB_SR.mat,... always remains movingly genuine.,5
155,ZAB,157,task1-SR,resultsZAB_SR.mat,"Stitch is a bad mannered, ugly and destructive little ****.",10
156,ZAB,158,task1-SR,resultsZAB_SR.mat,The cast is top-notch and I predict there will be plenty of female audience members drooling over Michael Idemoto as Michael.,21
157,ZAB,159,task1-SR,resultsZAB_SR.mat,Kirshner and Monroe seem to be in a contest to see who can out-bad-act the other.,16
158,ZAB,160,task1-SR,resultsZAB_SR.mat,This is one of those war movies that focuses on human interaction rather than battle and action sequences... and it's all the stronger because of it.,26
159,ZAB,161,task1-SR,resultsZAB_SR.mat,"Like life on the island, the movie grows boring despite the scenery.",12
160,ZAB,162,task1-SR,resultsZAB_SR.mat,It's anchored by splendid performances from an honored screen veteran and a sparkling newcomer who instantly transform themselves into a believable mother/daughter pair.,23
161,ZAB,163,task1-SR,resultsZAB_SR.mat,An atonal estrogen opera that demonizes feminism while gifting the most sympathetic male of the piece with a nice vomit bath at his wedding.,24
162,ZAB,164,task1-SR,resultsZAB_SR.mat,"Even by the intentionally low standards of frat-boy humor, Sorority Boys is a bowser.",14
163,ZAB,165,task1-SR,resultsZAB_SR.mat,"Director of photography Benoit Delhomme shot the movie in delicious colors, and the costumes and sets are grand.",18
164,ZAB,166,task1-SR,resultsZAB_SR.mat,The only entertainment you'll derive from this choppy and sloppy affair will be from unintentional giggles -- several of them.,20
165,ZAB,167,task1-SR,resultsZAB_SR.mat,The film serves as a valuable time capsule to remind us of the devastating horror suffered by an entire people.,20
166,ZAB,168,task1-SR,resultsZAB_SR.mat,"A bittersweet contemporary comedy about benevolent deception, which, while it may not rival the filmmaker's period pieces, is still very much worth seeing.",23
167,ZAB,169,task1-SR,resultsZAB_SR.mat,Attal pushes too hard to make this a comedy or serious drama.,12
168,ZAB,170,task1-SR,resultsZAB_SR.mat,Isabelle Huppert excels as the enigmatic Mika and Anna Mouglalis is a stunning new young talent in one of Chabrol's most intense psychological mysteries.,24
169,ZAB,171,task1-SR,resultsZAB_SR.mat,A small movie with a big impact.,7
170,ZAB,173,task1-SR,resultsZAB_SR.mat,Photographed with melancholy richness and eloquently performed yet also decidedly uncinematic.,11
171,ZAB,174,task1-SR,resultsZAB_SR.mat,"Hey Arnold! is now stretched to barely feature length, with a little more attention paid to the animation.",18
172,ZAB,175,task1-SR,resultsZAB_SR.mat,"After that, it just gets stupid and maudlin.",8
173,ZAB,176,task1-SR,resultsZAB_SR.mat,"The stunning, dreamlike visuals will impress even those viewers who have little patience for Euro-film pretension.",16
174,ZAB,177,task1-SR,resultsZAB_SR.mat,"Plods along, minus the twisted humor and eye-popping visuals that have made Miike... a cult hero.",16
175,ZAB,178,task1-SR,resultsZAB_SR.mat,"Impresses as a skillfully assembled, highly polished and professional adaptation... just about as chilling and unsettling as `Manhunter' was.",19
176,ZAB,179,task1-SR,resultsZAB_SR.mat,"For the most part, it's a work of incendiary genius, steering clear of knee-jerk reactions and quick solutions.",18
